{
  "acknowledged_boundaries": {
    "comparison_only": true,
    "no_architecture_approval": true,
    "no_cross_capability_fitness": true,
    "no_requirements_satisfaction": true,
    "no_risk_acceptance": true,
    "single_capability_only": true
  },
  "candidate_hash": "sha256:321186b8016dde5dee6f4948d5254397a011e6796b0c63ae5bebf49ab2d3faab",
  "candidate_id": "00f8b5b9-19f9-5a1b-8cd1-3122333f2d55",
  "decided_at": "2026-08-02T09:00:00Z",
  "decided_by": {
    "authority_name": "thomasverburgt",
    "authority_role": "project-owner",
    "subject_id": "HUMAN-PROJECT-OWNER-001"
  },
  "decision_authority": "project_owner",
  "deployment_effect": "none",
  "disposition": "accept_semantically_faithful",
  "disposition_hash": "sha256:ce17eb5e49c93e60ac04e2955299cb2a1c13b43bfdc02bbe4da3c5f3fe638eea",
  "disposition_id": "68e9d697-10b5-5ff4-860e-3717ddfbebbd",
  "effect": "semantic_acceptance_record_only",
  "packet_hash": "sha256:170b55b2ff03a9e4ca034f52f3eedec3a2cb3c9d948146bb0eafb5c6db8126e5",
  "packet_id": "09c336f5-faa1-519a-a375-b4ba18cf2384",
  "report_effect": "none",
  "reviewed_dimensions": [
    "source_semantics",
    "anti_double_counting",
    "single_capability_scope",
    "unsupported_claim_suppression",
    "confidence_and_uncertainty",
    "downstream_handoff",
    "authority_boundary",
    "rollback"
  ],
  "scheduling_authorized": false,
  "semantic_judgment": {
    "architecture_coherence": "insufficient_evidence",
    "confidence_interpretation": "confidence_in_unassessability_not_architecture_readiness",
    "statement": "Semantic disposition passes."
  }
}
